{"ir_version":"0.3","meta":{"created":"2026-09-22","niche":"restaurant","source":"hand-built"},"nodes":[{"id":"website","kind":"system","label":"Website","parent":"root"},{"id":"website.home","kind":"page","label":"Home","parent":"website"},{"id":"website.menu","kind":"page","label":"Menu","parent":"website"},{"id":"website.location","kind":"page","label":"Location","parent":"website"},{"id":"website.contact","kind":"page","label":"Contact","parent":"website"},{"id":"acquire","kind":"system","label":"Customer acquisition","parent":"root"},{"id":"acquire.google","kind":"channel","label":"Google presence","parent":"acquire"},{"id":"acquire.reviews","kind":"channel","label":"Reviews","parent":"acquire"},{"id":"ops","kind":"system","label":"Operations","parent":"root"},{"id":"ops.reservations","kind":"function","label":"Reservations","parent":"ops"},{"id":"ops.messages","kind":"function","label":"Messages","parent":"ops"},{"id":"maintain","kind":"system","label":"Maintenance","parent":"root"},{"id":"maintain.visibility","kind":"function","label":"Visibility monitoring","parent":"maintain"},{"id":"offer","kind":"offer","label":"Offer","parent":"root"},{"id":"offer.setup","kind":"function","label":"Setup package","parent":"offer"},{"id":"offer.care-plan","kind":"function","label":"Monthly care plan","parent":"offer"}],"root":{"id":"root","kind":"business","label":"Restaurant"},"tree_id":"restaurant-os-001"}