{"ir_version":"0.3","meta":{"created":"2026-09-22","niche":"honolulu-smb","source":"hand-built"},"nodes":[{"id":"audit","kind":"system","label":"Visibility audit","parent":"root"},{"id":"audit.ai-answers","kind":"function","label":"AI answers check","note":"How ChatGPT, Perplexity, Google AI describe the business vs competitors","parent":"audit"},{"id":"audit.competitors","kind":"function","label":"Competitor compare","parent":"audit"},{"id":"audit.gap-report","kind":"page","label":"Gap report","parent":"audit"},{"id":"fix","kind":"system","label":"Fix list","parent":"root"},{"id":"fix.google-profile","kind":"function","label":"Google profile fix","parent":"fix"},{"id":"fix.reviews","kind":"function","label":"Review engine","parent":"fix"},{"id":"fix.content","kind":"function","label":"Content gaps","parent":"fix"},{"id":"offer","kind":"offer","label":"Offer","parent":"root"},{"id":"offer.audit","kind":"function","label":"Paid visibility audit","note":"Entry price: the $9-style front door","parent":"offer"},{"id":"offer.monitoring","kind":"function","label":"Monthly monitoring","note":"Recurring: keep them visible, keep them paying","parent":"offer"},{"id":"proof","kind":"system","label":"Proof","parent":"root"},{"id":"proof.before-after","kind":"page","label":"Before / after","parent":"proof"},{"id":"proof.testimonials","kind":"page","label":"Testimonials","parent":"proof"}],"root":{"id":"root","kind":"business","label":"Honolulu SMB"},"tree_id":"visibility-audit-001"}